{
  "schema": "latexai/paper-experiment/1",
  "measurement": {
    "path": "D:/example/batch/inputs/engine/scripts/gauntlet-convert.ps1",
    "sha256": "0000000000000000000000000000000000000000000000000000000000000000"
  },
  "conditions": [
    {
      "id": "off",
      "status": "ok",
      "engine": {
        "root": "D:/example/batch/inputs/engine",
        "version": "example",
        "commit": "example"
      },
      "execution": {
        "outcome": "exited",
        "exitCode": 0,
        "timedOut": false,
        "cleanupComplete": true
      },
      "outputs": {
        "xml": "conditions/off/paper.xml"
      },
      "counts": {
        "exitCode": 0,
        "timedOut": 0,
        "mathElements": 1,
        "latexmlMs": 500.25
      },
      "details": {
        "arguments": [],
        "packages": [],
        "taxonomy": [],
        "missingFiles": [],
        "undefinedMacros": [],
        "errorNodes": [],
        "internalLeaks": [],
        "danglingRefs": []
      },
      "durationMs": 520.5,
      "memory": {
        "method": "sampled-process-PeakWorkingSet64",
        "bytes": 42000000
      }
    },
    {
      "id": "on",
      "status": "ok",
      "engine": {
        "root": "D:/example/batch/inputs/engine",
        "version": "example",
        "commit": "example"
      },
      "execution": {
        "outcome": "exited",
        "exitCode": 0,
        "timedOut": false,
        "cleanupComplete": true
      },
      "outputs": {
        "xml": "conditions/on/paper.xml"
      },
      "counts": {
        "exitCode": 0,
        "timedOut": 0,
        "mathElements": 1,
        "latexmlMs": 500.25
      },
      "details": {
        "arguments": [
          "--capture"
        ],
        "packages": [],
        "taxonomy": [],
        "missingFiles": [],
        "undefinedMacros": [],
        "errorNodes": [],
        "internalLeaks": [],
        "danglingRefs": []
      },
      "durationMs": 520.5,
      "memory": {
        "method": "sampled-process-PeakWorkingSet64",
        "bytes": 42000000
      }
    }
  ],
  "comparisons": [
    {
      "mode": "parity",
      "right": "on",
      "issues": [],
      "left": "off",
      "durationMs": 200.5,
      "required": true,
      "report": "comparisons/parity/comparison.json",
      "process": {
        "exitCode": 0,
        "cleanupComplete": true,
        "outcome": "exited",
        "timedOut": false
      },
      "id": "parity",
      "status": "pass"
    }
  ],
  "freeze": {
    "sha256": "0000000000000000000000000000000000000000000000000000000000000000",
    "path": "D:/example/batch/inputs/freeze.json"
  },
  "order": [
    "off",
    "on"
  ],
  "integrityIssues": []
}
